{
  "schemaVersion": "bout/1",
  "id": "ufc:bout:ufc-ufc-fight-night-gamrot-vs-salkilld-bout-giovanna-canuto-vs-carol-foro-12",
  "org": "ufc",
  "event": {
    "ref": "ufc:event:ufc-fight-night-gamrot-vs-salkilld",
    "name": "UFC Fight Night: Gamrot vs. Salkilld",
    "startsAtUtc": "2026-08-08T00:00:00.000Z",
    "venue": "Meta Apex"
  },
  "fighters": {
    "red": "ufc:giovanna-canuto",
    "blue": "ufc:carol-foro"
  },
  "division": "womens-strawweight",
  "scheduledRounds": 3,
  "status": "completed",
  "statusHistory": [
    {
      "status": "announced",
      "at": "2026-08-06T06:00:43.585Z",
      "sourceRefs": [
        "source:wikipedia:2026-08-06:List of UFC events"
      ],
      "note": "Status imported from the Cito event listing."
    },
    {
      "status": "completed",
      "at": "2026-08-12T06:01:46.400Z",
      "sourceRefs": [
        "source:wikipedia:2026-08-12:UFC Fight Night: Gamrot vs. Salkilld"
      ],
      "note": "Result read from the UFC Fight Night: Gamrot vs. Salkilld article after the event."
    }
  ],
  "discovery": {
    "firstSeenAt": "2026-08-06T06:00:43.585Z",
    "lastSeenAt": "2026-08-06T06:00:43.585Z",
    "sourceRefs": [
      "source:wikipedia:2026-08-06:List of UFC events"
    ]
  },
  "sourceRefs": [
    "source:wikipedia:2026-08-06:List of UFC events",
    "source:wikipedia:2026-08-12:UFC Fight Night: Gamrot vs. Salkilld"
  ],
  "result": {
    "winner": "blue",
    "method": "Decision (unanimous)",
    "round": 3,
    "elapsedSeconds": 900,
    "sourceRefs": [
      "source:wikipedia:2026-08-12:UFC Fight Night: Gamrot vs. Salkilld"
    ]
  },
  "predictionRefs": [],
  "changeLog": [
    {
      "at": "2026-08-06T06:00:43.585Z",
      "kind": "created",
      "fields": [
        "event",
        "fighters",
        "status"
      ],
      "sourceRefs": [
        "source:wikipedia:2026-08-06:List of UFC events"
      ],
      "note": "Discovered on the approved Cito free-tier intake."
    },
    {
      "at": "2026-08-12T06:01:46.400Z",
      "kind": "status-change",
      "fields": [
        "status",
        "result"
      ],
      "sourceRefs": [
        "source:wikipedia:2026-08-12:UFC Fight Night: Gamrot vs. Salkilld"
      ],
      "note": "Carol Foro def. Giovanna Canuto by Decision (unanimous)."
    }
  ],
  "updatedAt": "2026-08-12T06:01:46.400Z"
}
