{
  "schemaVersion": "bout/1",
  "id": "ufc:bout:ufc-ufc-fight-night-hooker-vs-parnasse-bout-michael-aljarouj-vs-fabia-sintes-11",
  "org": "ufc",
  "event": {
    "ref": "ufc:event:ufc-fight-night-hooker-vs-parnasse",
    "name": "UFC Fight Night: Hooker vs. Parnasse",
    "startsAtUtc": "2026-09-05T00:00:00.000Z",
    "venue": "Accor Arena"
  },
  "fighters": {
    "red": "ufc:michael-aljarouj",
    "blue": "ufc:fabia-sintes"
  },
  "division": "flyweight",
  "scheduledRounds": 3,
  "status": "completed",
  "statusHistory": [
    {
      "status": "announced",
      "at": "2026-08-27T06:00:56.984Z",
      "sourceRefs": [
        "source:wikipedia:2026-08-27:List of UFC events"
      ],
      "note": "Status imported from the Cito event listing."
    },
    {
      "status": "completed",
      "at": "2026-09-08T06:01:01.803Z",
      "sourceRefs": [
        "source:wikipedia:2026-09-08:UFC Fight Night: Hooker vs. Parnasse"
      ],
      "note": "Result read from the UFC Fight Night: Hooker vs. Parnasse article after the event."
    }
  ],
  "discovery": {
    "firstSeenAt": "2026-08-27T06:00:56.984Z",
    "lastSeenAt": "2026-08-30T06:01:50.158Z",
    "sourceRefs": [
      "source:wikipedia:2026-08-27:List of UFC events",
      "source:wikipedia:2026-08-28:List of UFC events",
      "source:wikipedia:2026-08-30:List of UFC events"
    ]
  },
  "sourceRefs": [
    "source:wikipedia:2026-08-27:List of UFC events",
    "source:wikipedia:2026-08-28:List of UFC events",
    "source:wikipedia:2026-08-30:List of UFC events",
    "source:wikipedia:2026-09-08:UFC Fight Night: Hooker vs. Parnasse"
  ],
  "result": {
    "winner": "blue",
    "method": "Decision (unanimous)",
    "round": 3,
    "elapsedSeconds": 900,
    "sourceRefs": [
      "source:wikipedia:2026-09-08:UFC Fight Night: Hooker vs. Parnasse"
    ]
  },
  "predictionRefs": [],
  "changeLog": [
    {
      "at": "2026-08-27T06:00:56.984Z",
      "kind": "created",
      "fields": [
        "event",
        "fighters",
        "status"
      ],
      "sourceRefs": [
        "source:wikipedia:2026-08-27:List of UFC events"
      ],
      "note": "Discovered on the approved Cito free-tier intake."
    },
    {
      "at": "2026-09-08T06:01:01.803Z",
      "kind": "status-change",
      "fields": [
        "status",
        "result"
      ],
      "sourceRefs": [
        "source:wikipedia:2026-09-08:UFC Fight Night: Hooker vs. Parnasse"
      ],
      "note": "Fabià Sintes def. Michael Aljarouj by Decision (unanimous)."
    }
  ],
  "updatedAt": "2026-09-08T06:01:01.803Z"
}
