{
  "schemaVersion": "bout/1",
  "id": "oktagon:bout:history-b77de5bcaa8ebd5590c8",
  "org": "oktagon",
  "event": {
    "ref": "oktagon:event:history-ufc-on-fuel-tv-nogueira-vs-werdum",
    "name": "UFC on Fuel TV: Nogueira vs. Werdum",
    "startsAtUtc": "2013-06-08T00:00:00.000Z",
    "venue": null
  },
  "fighters": {
    "red": "oktagon:karlos-vemola",
    "blue": "oktagon:caio-magalhaes"
  },
  "division": null,
  "scheduledRounds": null,
  "status": "completed",
  "statusHistory": [
    {
      "status": "completed",
      "at": "2013-06-08T00:00:00.000Z",
      "sourceRefs": [
        "source:wikipedia:26668929"
      ],
      "note": "Historical result imported from a cited Wikipedia record table."
    }
  ],
  "discovery": {
    "firstSeenAt": "2026-08-02T14:14:59.647Z",
    "lastSeenAt": "2026-08-02T14:14:59.647Z",
    "sourceRefs": [
      "source:wikipedia:26668929"
    ]
  },
  "sourceRefs": [
    "source:wikipedia:26668929"
  ],
  "result": {
    "winner": "blue",
    "method": "Submission (rear-naked choke)",
    "round": 2,
    "elapsedSeconds": 469,
    "sourceRefs": [
      "source:wikipedia:26668929"
    ]
  },
  "predictionRefs": [],
  "changeLog": [
    {
      "at": "2026-08-02T14:14:59.647Z",
      "kind": "created",
      "fields": [
        "fighters",
        "event",
        "result"
      ],
      "sourceRefs": [
        "source:wikipedia:26668929"
      ],
      "note": "Created from a single-source historical row; confidence remains provisional."
    }
  ],
  "updatedAt": "2026-08-02T14:14:59.647Z"
}
