{
  "schemaVersion": "bout/1",
  "id": "ufc:bout:history-003f7730458fdcb19f97",
  "org": "ufc",
  "event": {
    "ref": "ufc:event:history-ufc-fight-night-adesanya-vs-pyfer",
    "name": "UFC Fight Night: Adesanya vs. Pyfer",
    "startsAtUtc": "2026-03-28T00:00:00.000Z",
    "venue": null
  },
  "fighters": {
    "red": "ufc:alexa-grasso",
    "blue": "ufc:maycee-barber"
  },
  "division": null,
  "scheduledRounds": null,
  "status": "completed",
  "statusHistory": [
    {
      "status": "completed",
      "at": "2026-03-28T00:00:00.000Z",
      "sourceRefs": [
        "source:wikipedia:45441761"
      ],
      "note": "Historical result imported from a cited Wikipedia record table."
    }
  ],
  "discovery": {
    "firstSeenAt": "2026-08-02T15:43:59.798Z",
    "lastSeenAt": "2026-08-02T15:43:59.798Z",
    "sourceRefs": [
      "source:wikipedia:45441761"
    ]
  },
  "sourceRefs": [
    "source:wikipedia:45441761"
  ],
  "result": {
    "winner": "red",
    "method": "KO (punch)",
    "round": 1,
    "elapsedSeconds": 162,
    "sourceRefs": [
      "source:wikipedia:45441761"
    ]
  },
  "predictionRefs": [],
  "changeLog": [
    {
      "at": "2026-08-02T15:43:59.798Z",
      "kind": "created",
      "fields": [
        "fighters",
        "event",
        "result"
      ],
      "sourceRefs": [
        "source:wikipedia:45441761"
      ],
      "note": "Created from a single-source historical row; confidence remains provisional."
    }
  ],
  "updatedAt": "2026-08-02T15:43:59.798Z"
}
