{
  "schemaVersion": "bout/1",
  "id": "ufc:bout:history-54faf604819964974d1e",
  "org": "ufc",
  "event": {
    "ref": "ufc:event:history-universal-above-ground-fighting",
    "name": "Universal Above Ground Fighting",
    "startsAtUtc": "2005-07-28T00:00:00.000Z",
    "venue": null
  },
  "fighters": {
    "red": "ufc:aaron-brink",
    "blue": "ufc:john-meirzwa"
  },
  "division": null,
  "scheduledRounds": null,
  "status": "completed",
  "statusHistory": [
    {
      "status": "completed",
      "at": "2005-07-28T00:00:00.000Z",
      "sourceRefs": [
        "source:wikipedia:46641727"
      ],
      "note": "Historical result imported from a cited Wikipedia record table."
    }
  ],
  "discovery": {
    "firstSeenAt": "2026-08-01T23:30:59.810Z",
    "lastSeenAt": "2026-08-01T23:30:59.810Z",
    "sourceRefs": [
      "source:wikipedia:46641727"
    ]
  },
  "sourceRefs": [
    "source:wikipedia:46641727"
  ],
  "result": {
    "winner": "red",
    "method": "TKO (injury)",
    "round": 1,
    "elapsedSeconds": null,
    "sourceRefs": [
      "source:wikipedia:46641727"
    ]
  },
  "predictionRefs": [],
  "changeLog": [
    {
      "at": "2026-08-01T23:30:59.810Z",
      "kind": "created",
      "fields": [
        "fighters",
        "event",
        "result"
      ],
      "sourceRefs": [
        "source:wikipedia:46641727"
      ],
      "note": "Created from a single-source historical row; confidence remains provisional."
    }
  ],
  "updatedAt": "2026-08-01T23:30:59.810Z"
}
