{
  "schemaVersion": "bout/1",
  "id": "ufc:bout:history-a6571743685f8f86456b",
  "org": "ufc",
  "event": {
    "ref": "ufc:event:history-shooto-vale-tudo-junction-3",
    "name": "Shooto: Vale Tudo Junction 3",
    "startsAtUtc": "1996-05-07T00:00:00.000Z",
    "venue": null
  },
  "fighters": {
    "red": "ufc:akihiro-gono",
    "blue": "ufc:todd-bjornethun"
  },
  "division": null,
  "scheduledRounds": null,
  "status": "completed",
  "statusHistory": [
    {
      "status": "completed",
      "at": "1996-05-07T00:00:00.000Z",
      "sourceRefs": [
        "source:wikipedia:5585490"
      ],
      "note": "Historical result imported from a cited Wikipedia record table."
    }
  ],
  "discovery": {
    "firstSeenAt": "2026-08-01T23:30:59.810Z",
    "lastSeenAt": "2026-08-01T23:30:59.810Z",
    "sourceRefs": [
      "source:wikipedia:5585490"
    ]
  },
  "sourceRefs": [
    "source:wikipedia:5585490"
  ],
  "result": {
    "winner": "blue",
    "method": "Submission (armbar)",
    "round": 3,
    "elapsedSeconds": 672,
    "sourceRefs": [
      "source:wikipedia:5585490"
    ]
  },
  "predictionRefs": [],
  "changeLog": [
    {
      "at": "2026-08-01T23:30:59.810Z",
      "kind": "created",
      "fields": [
        "fighters",
        "event",
        "result"
      ],
      "sourceRefs": [
        "source:wikipedia:5585490"
      ],
      "note": "Created from a single-source historical row; confidence remains provisional."
    }
  ],
  "updatedAt": "2026-08-01T23:30:59.810Z"
}
