{
  "schemaVersion": "bout/1",
  "id": "ufc:bout:history-61ef8478165f31ea11d6",
  "org": "ufc",
  "event": {
    "ref": "ufc:event:history-ufc-266",
    "name": "UFC 266",
    "startsAtUtc": "2021-09-25T00:00:00.000Z",
    "venue": null
  },
  "fighters": {
    "red": "ufc:alexander-volkanovski",
    "blue": "ufc:brian-ortega"
  },
  "division": null,
  "scheduledRounds": null,
  "status": "completed",
  "statusHistory": [
    {
      "status": "completed",
      "at": "2021-09-25T00:00:00.000Z",
      "sourceRefs": [
        "source:wikipedia:54197580"
      ],
      "note": "Historical result imported from a cited Wikipedia record table."
    }
  ],
  "discovery": {
    "firstSeenAt": "2026-08-03T18:02:51.598Z",
    "lastSeenAt": "2026-08-03T18:02:51.598Z",
    "sourceRefs": [
      "source:wikipedia:54197580"
    ]
  },
  "sourceRefs": [
    "source:wikipedia:54197580"
  ],
  "result": {
    "winner": "red",
    "method": "Decision (unanimous)",
    "round": 5,
    "elapsedSeconds": 1500,
    "sourceRefs": [
      "source:wikipedia:54197580"
    ]
  },
  "predictionRefs": [],
  "changeLog": [
    {
      "at": "2026-08-03T18:02:51.598Z",
      "kind": "created",
      "fields": [
        "fighters",
        "event",
        "result"
      ],
      "sourceRefs": [
        "source:wikipedia:54197580"
      ],
      "note": "Created from a single-source historical row; confidence remains provisional."
    }
  ],
  "updatedAt": "2026-08-03T18:02:51.598Z"
}
