{
  "schemaVersion": "bout/1",
  "id": "ufc:bout:history-4933d4e5f66694c81aeb",
  "org": "ufc",
  "event": {
    "ref": "ufc:event:history-world-ultimate-full-contact-16",
    "name": "World Ultimate Full Contact 16",
    "startsAtUtc": "2010-09-04T00:00:00.000Z",
    "venue": null
  },
  "fighters": {
    "red": "ufc:amir-albazi",
    "blue": "ufc:bagandov-murada"
  },
  "division": null,
  "scheduledRounds": null,
  "status": "completed",
  "statusHistory": [
    {
      "status": "completed",
      "at": "2010-09-04T00:00:00.000Z",
      "sourceRefs": [
        "source:wikipedia:64585580"
      ],
      "note": "Historical result imported from a cited Wikipedia record table."
    }
  ],
  "discovery": {
    "firstSeenAt": "2026-08-02T15:43:59.798Z",
    "lastSeenAt": "2026-08-02T15:43:59.798Z",
    "sourceRefs": [
      "source:wikipedia:64585580"
    ]
  },
  "sourceRefs": [
    "source:wikipedia:64585580"
  ],
  "result": {
    "winner": "red",
    "method": "TKO (punches)",
    "round": 1,
    "elapsedSeconds": 180,
    "sourceRefs": [
      "source:wikipedia:64585580"
    ]
  },
  "predictionRefs": [],
  "changeLog": [
    {
      "at": "2026-08-02T15:43:59.798Z",
      "kind": "created",
      "fields": [
        "fighters",
        "event",
        "result"
      ],
      "sourceRefs": [
        "source:wikipedia:64585580"
      ],
      "note": "Created from a single-source historical row; confidence remains provisional."
    }
  ],
  "updatedAt": "2026-08-02T15:43:59.798Z"
}
