{
  "schemaVersion": "bout/1",
  "id": "oktagon:bout:history-c4ed2278e54c19e0db92",
  "org": "oktagon",
  "event": {
    "ref": "oktagon:event:history-ufc-fight-night-evloev-vs-murphy",
    "name": "UFC Fight Night: Evloev vs. Murphy",
    "startsAtUtc": "2026-03-21T00:00:00.000Z",
    "venue": null
  },
  "fighters": {
    "red": "oktagon:losene-keita",
    "blue": "oktagon:nathaniel-wood"
  },
  "division": null,
  "scheduledRounds": null,
  "status": "completed",
  "statusHistory": [
    {
      "status": "completed",
      "at": "2026-03-21T00:00:00.000Z",
      "sourceRefs": [
        "source:wikipedia:78757319"
      ],
      "note": "Historical result imported from a cited Wikipedia record table."
    }
  ],
  "discovery": {
    "firstSeenAt": "2026-08-02T14:14:59.647Z",
    "lastSeenAt": "2026-08-02T14:14:59.647Z",
    "sourceRefs": [
      "source:wikipedia:78757319"
    ]
  },
  "sourceRefs": [
    "source:wikipedia:78757319"
  ],
  "result": {
    "winner": "blue",
    "method": "Decision (split)",
    "round": 3,
    "elapsedSeconds": 900,
    "sourceRefs": [
      "source:wikipedia:78757319"
    ]
  },
  "predictionRefs": [],
  "changeLog": [
    {
      "at": "2026-08-02T14:14:59.647Z",
      "kind": "created",
      "fields": [
        "fighters",
        "event",
        "result"
      ],
      "sourceRefs": [
        "source:wikipedia:78757319"
      ],
      "note": "Created from a single-source historical row; confidence remains provisional."
    }
  ],
  "updatedAt": "2026-08-02T14:14:59.647Z"
}
