{
  "schemaVersion": "bout/1",
  "id": "ufc:bout:history-2eee850e1facc291c21b",
  "org": "ufc",
  "event": {
    "ref": "ufc:event:history-lumax-cup-tournament-of-j-94",
    "name": "Lumax Cup: Tournament of J '94",
    "startsAtUtc": "1994-04-23T00:00:00.000Z",
    "venue": null
  },
  "fighters": {
    "red": "ufc:akihiro-gono",
    "blue": "ufc:yasunori-okuda"
  },
  "division": null,
  "scheduledRounds": null,
  "status": "completed",
  "statusHistory": [
    {
      "status": "completed",
      "at": "1994-04-23T00:00:00.000Z",
      "sourceRefs": [
        "source:wikipedia:5585490"
      ],
      "note": "Historical result imported from a cited Wikipedia record table."
    }
  ],
  "discovery": {
    "firstSeenAt": "2026-08-01T23:30:59.810Z",
    "lastSeenAt": "2026-08-01T23:30:59.810Z",
    "sourceRefs": [
      "source:wikipedia:5585490"
    ]
  },
  "sourceRefs": [
    "source:wikipedia:5585490"
  ],
  "result": {
    "winner": "blue",
    "method": "Submission (toe hold)",
    "round": 1,
    "elapsedSeconds": 111,
    "sourceRefs": [
      "source:wikipedia:5585490"
    ]
  },
  "predictionRefs": [],
  "changeLog": [
    {
      "at": "2026-08-01T23:30:59.810Z",
      "kind": "created",
      "fields": [
        "fighters",
        "event",
        "result"
      ],
      "sourceRefs": [
        "source:wikipedia:5585490"
      ],
      "note": "Created from a single-source historical row; confidence remains provisional."
    }
  ],
  "updatedAt": "2026-08-01T23:30:59.810Z"
}
