{
  "schemaVersion": "bout/1",
  "id": "ufc:bout:history-87411aaa664fdbcaaa0b",
  "org": "ufc",
  "event": {
    "ref": "ufc:event:history-gladiator-challenge-domination",
    "name": "Gladiator Challenge: Domination",
    "startsAtUtc": "2010-03-06T00:00:00.000Z",
    "venue": null
  },
  "fighters": {
    "red": "ufc:andre-fili",
    "blue": "ufc:cain-campos"
  },
  "division": null,
  "scheduledRounds": null,
  "status": "completed",
  "statusHistory": [
    {
      "status": "completed",
      "at": "2010-03-06T00:00:00.000Z",
      "sourceRefs": [
        "source:wikipedia:40814604"
      ],
      "note": "Historical result imported from a cited Wikipedia record table."
    }
  ],
  "discovery": {
    "firstSeenAt": "2026-08-02T15:43:59.798Z",
    "lastSeenAt": "2026-08-02T15:43:59.798Z",
    "sourceRefs": [
      "source:wikipedia:40814604"
    ]
  },
  "sourceRefs": [
    "source:wikipedia:40814604"
  ],
  "result": {
    "winner": "red",
    "method": "TKO (punches)",
    "round": 1,
    "elapsedSeconds": 16,
    "sourceRefs": [
      "source:wikipedia:40814604"
    ]
  },
  "predictionRefs": [],
  "changeLog": [
    {
      "at": "2026-08-02T15:43:59.798Z",
      "kind": "created",
      "fields": [
        "fighters",
        "event",
        "result"
      ],
      "sourceRefs": [
        "source:wikipedia:40814604"
      ],
      "note": "Created from a single-source historical row; confidence remains provisional."
    }
  ],
  "updatedAt": "2026-08-02T15:43:59.798Z"
}
