{
  "schemaVersion": "bout/1",
  "id": "ufc:bout:history-14e364a00205184d049d",
  "org": "ufc",
  "event": {
    "ref": "ufc:event:history-total-combat-12",
    "name": "Total Combat 12",
    "startsAtUtc": "2005-12-17T00:00:00.000Z",
    "venue": null
  },
  "fighters": {
    "red": "ufc:akbarh-arreola",
    "blue": "ufc:toby-imada"
  },
  "division": null,
  "scheduledRounds": null,
  "status": "completed",
  "statusHistory": [
    {
      "status": "completed",
      "at": "2005-12-17T00:00:00.000Z",
      "sourceRefs": [
        "source:wikipedia:46801690"
      ],
      "note": "Historical result imported from a cited Wikipedia record table."
    }
  ],
  "discovery": {
    "firstSeenAt": "2026-08-01T23:30:59.810Z",
    "lastSeenAt": "2026-08-01T23:30:59.810Z",
    "sourceRefs": [
      "source:wikipedia:46801690"
    ]
  },
  "sourceRefs": [
    "source:wikipedia:46801690"
  ],
  "result": {
    "winner": "blue",
    "method": "Decision (unanimous)",
    "round": 3,
    "elapsedSeconds": 900,
    "sourceRefs": [
      "source:wikipedia:46801690"
    ]
  },
  "predictionRefs": [],
  "changeLog": [
    {
      "at": "2026-08-01T23:30:59.810Z",
      "kind": "created",
      "fields": [
        "fighters",
        "event",
        "result"
      ],
      "sourceRefs": [
        "source:wikipedia:46801690"
      ],
      "note": "Created from a single-source historical row; confidence remains provisional."
    }
  ],
  "updatedAt": "2026-08-01T23:30:59.810Z"
}
