{
  "schemaVersion": "bout/1",
  "id": "ufc:bout:history-4321ec9c4340245bd9c0",
  "org": "ufc",
  "event": {
    "ref": "ufc:event:history-alash-pride-fc-almaty-arena",
    "name": "Alash Pride FC: Almaty Arena",
    "startsAtUtc": "2017-12-30T00:00:00.000Z",
    "venue": null
  },
  "fighters": {
    "red": "ufc:asu-almabayev",
    "blue": "ufc:kenan-jafarli"
  },
  "division": null,
  "scheduledRounds": null,
  "status": "completed",
  "statusHistory": [
    {
      "status": "completed",
      "at": "2017-12-30T00:00:00.000Z",
      "sourceRefs": [
        "source:wikipedia:77593874"
      ],
      "note": "Historical result imported from a cited Wikipedia record table."
    }
  ],
  "discovery": {
    "firstSeenAt": "2026-08-02T15:43:59.798Z",
    "lastSeenAt": "2026-08-02T15:43:59.798Z",
    "sourceRefs": [
      "source:wikipedia:77593874"
    ]
  },
  "sourceRefs": [
    "source:wikipedia:77593874"
  ],
  "result": {
    "winner": "red",
    "method": "Decision (unanimous)",
    "round": 2,
    "elapsedSeconds": 600,
    "sourceRefs": [
      "source:wikipedia:77593874"
    ]
  },
  "predictionRefs": [],
  "changeLog": [
    {
      "at": "2026-08-02T15:43:59.798Z",
      "kind": "created",
      "fields": [
        "fighters",
        "event",
        "result"
      ],
      "sourceRefs": [
        "source:wikipedia:77593874"
      ],
      "note": "Created from a single-source historical row; confidence remains provisional."
    }
  ],
  "updatedAt": "2026-08-02T15:43:59.798Z"
}
