{
  "schemaVersion": "bout/1",
  "id": "ufc:bout:history-8072e51cb289a79c69fd",
  "org": "ufc",
  "event": {
    "ref": "ufc:event:history-mma-xtreme-1",
    "name": "MMA Xtreme 1",
    "startsAtUtc": "2006-03-25T00:00:00.000Z",
    "venue": null
  },
  "fighters": {
    "red": "ufc:akbarh-arreola",
    "blue": "ufc:jude-gonzales"
  },
  "division": null,
  "scheduledRounds": null,
  "status": "completed",
  "statusHistory": [
    {
      "status": "completed",
      "at": "2006-03-25T00:00:00.000Z",
      "sourceRefs": [
        "source:wikipedia:46801690"
      ],
      "note": "Historical result imported from a cited Wikipedia record table."
    }
  ],
  "discovery": {
    "firstSeenAt": "2026-08-01T23:30:59.810Z",
    "lastSeenAt": "2026-08-01T23:30:59.810Z",
    "sourceRefs": [
      "source:wikipedia:46801690"
    ]
  },
  "sourceRefs": [
    "source:wikipedia:46801690"
  ],
  "result": {
    "winner": "red",
    "method": "Submission (triangle Choke)",
    "round": 1,
    "elapsedSeconds": 41,
    "sourceRefs": [
      "source:wikipedia:46801690"
    ]
  },
  "predictionRefs": [],
  "changeLog": [
    {
      "at": "2026-08-01T23:30:59.810Z",
      "kind": "created",
      "fields": [
        "fighters",
        "event",
        "result"
      ],
      "sourceRefs": [
        "source:wikipedia:46801690"
      ],
      "note": "Created from a single-source historical row; confidence remains provisional."
    }
  ],
  "updatedAt": "2026-08-01T23:30:59.810Z"
}
