{
  "schemaVersion": "bout/1",
  "id": "ufc:bout:ufc-ufc-330-makhachev-vs-machado-garry-bout-mansur-abdul-malik-vs-dustin-stoltzfus-4",
  "org": "ufc",
  "event": {
    "ref": "ufc:event:ufc-330-makhachev-vs-machado-garry",
    "name": "UFC 330: Makhachev vs. Machado Garry",
    "startsAtUtc": "2026-08-15T00:00:00.000Z",
    "venue": "Xfinity Mobile Arena"
  },
  "fighters": {
    "red": "ufc:mansur-abdul-malik",
    "blue": "ufc:dustin-stoltzfus"
  },
  "division": "middleweight",
  "scheduledRounds": 3,
  "status": "completed",
  "statusHistory": [
    {
      "status": "announced",
      "at": "2026-08-13T06:01:42.251Z",
      "sourceRefs": [
        "source:wikipedia:2026-08-13:List of UFC events"
      ],
      "note": "Status imported from the Cito event listing."
    },
    {
      "status": "completed",
      "at": "2026-08-16T06:00:53.643Z",
      "sourceRefs": [
        "source:wikipedia:2026-08-16:UFC 330: Makhachev vs. Machado Garry"
      ],
      "note": "Result read from the UFC 330: Makhachev vs. Machado Garry article after the event."
    }
  ],
  "discovery": {
    "firstSeenAt": "2026-08-13T06:01:42.251Z",
    "lastSeenAt": "2026-08-14T06:02:00.810Z",
    "sourceRefs": [
      "source:wikipedia:2026-08-13:List of UFC events",
      "source:wikipedia:2026-08-14:List of UFC events"
    ]
  },
  "sourceRefs": [
    "source:wikipedia:2026-08-13:List of UFC events",
    "source:wikipedia:2026-08-14:List of UFC events",
    "source:wikipedia:2026-08-16:UFC 330: Makhachev vs. Machado Garry"
  ],
  "result": {
    "winner": "blue",
    "method": "Submission (rear-naked choke)",
    "round": 2,
    "elapsedSeconds": 565,
    "sourceRefs": [
      "source:wikipedia:2026-08-16:UFC 330: Makhachev vs. Machado Garry"
    ]
  },
  "predictionRefs": [],
  "changeLog": [
    {
      "at": "2026-08-13T06:01:42.251Z",
      "kind": "created",
      "fields": [
        "event",
        "fighters",
        "status"
      ],
      "sourceRefs": [
        "source:wikipedia:2026-08-13:List of UFC events"
      ],
      "note": "Discovered on the approved Cito free-tier intake."
    },
    {
      "at": "2026-08-16T06:00:53.643Z",
      "kind": "status-change",
      "fields": [
        "status",
        "result"
      ],
      "sourceRefs": [
        "source:wikipedia:2026-08-16:UFC 330: Makhachev vs. Machado Garry"
      ],
      "note": "Dustin Stoltzfus def. Mansur Abdul-Malik by Submission (rear-naked choke)."
    }
  ],
  "updatedAt": "2026-08-16T06:00:53.643Z"
}
