{
  "schemaVersion": "bout/1",
  "id": "oktagon:bout:history-6dc1eee00cf6fccb75b2",
  "org": "oktagon",
  "event": {
    "ref": "oktagon:event:history-arena-berserkerow-3",
    "name": "Arena Berserkerów 3",
    "startsAtUtc": "2013-05-11T00:00:00.000Z",
    "venue": null
  },
  "fighters": {
    "red": "oktagon:makhmud-muradov",
    "blue": "oktagon:maciej-rozanski"
  },
  "division": null,
  "scheduledRounds": null,
  "status": "completed",
  "statusHistory": [
    {
      "status": "completed",
      "at": "2013-05-11T00:00:00.000Z",
      "sourceRefs": [
        "source:wikipedia:61905642"
      ],
      "note": "Historical result imported from a cited Wikipedia record table."
    }
  ],
  "discovery": {
    "firstSeenAt": "2026-08-02T14:14:59.647Z",
    "lastSeenAt": "2026-08-02T14:14:59.647Z",
    "sourceRefs": [
      "source:wikipedia:61905642"
    ]
  },
  "sourceRefs": [
    "source:wikipedia:61905642"
  ],
  "result": {
    "winner": "blue",
    "method": "Submission (guillotine choke)",
    "round": 2,
    "elapsedSeconds": 345,
    "sourceRefs": [
      "source:wikipedia:61905642"
    ]
  },
  "predictionRefs": [],
  "changeLog": [
    {
      "at": "2026-08-02T14:14:59.647Z",
      "kind": "created",
      "fields": [
        "fighters",
        "event",
        "result"
      ],
      "sourceRefs": [
        "source:wikipedia:61905642"
      ],
      "note": "Created from a single-source historical row; confidence remains provisional."
    }
  ],
  "updatedAt": "2026-08-02T14:14:59.647Z"
}
