{
  "schemaVersion": "bout/1",
  "id": "ufc:bout:history-2375dc80ae72bfb34abf",
  "org": "ufc",
  "event": {
    "ref": "ufc:event:history-ufc-fight-night-dawson-vs-green",
    "name": "UFC Fight Night: Dawson vs. Green",
    "startsAtUtc": "2023-10-07T00:00:00.000Z",
    "venue": null
  },
  "fighters": {
    "red": "ufc:aori-qileng",
    "blue": "ufc:johnny-munoz-jr"
  },
  "division": null,
  "scheduledRounds": null,
  "status": "completed",
  "statusHistory": [
    {
      "status": "completed",
      "at": "2023-10-07T00:00:00.000Z",
      "sourceRefs": [
        "source:wikipedia:70178359"
      ],
      "note": "Historical result imported from a cited Wikipedia record table."
    }
  ],
  "discovery": {
    "firstSeenAt": "2026-08-02T15:43:59.798Z",
    "lastSeenAt": "2026-08-02T15:43:59.798Z",
    "sourceRefs": [
      "source:wikipedia:70178359"
    ]
  },
  "sourceRefs": [
    "source:wikipedia:70178359"
  ],
  "result": {
    "winner": "red",
    "method": "Decision (unanimous)",
    "round": 3,
    "elapsedSeconds": 900,
    "sourceRefs": [
      "source:wikipedia:70178359"
    ]
  },
  "predictionRefs": [],
  "changeLog": [
    {
      "at": "2026-08-02T15:43:59.798Z",
      "kind": "created",
      "fields": [
        "fighters",
        "event",
        "result"
      ],
      "sourceRefs": [
        "source:wikipedia:70178359"
      ],
      "note": "Created from a single-source historical row; confidence remains provisional."
    }
  ],
  "updatedAt": "2026-08-02T15:43:59.798Z"
}
